{
  "$schema": "../../../report-index.schema.json",
  "generatedBy": "scripts/check-rtk-parity.py",
  "parts": [
    {
      "id": "rtk-public-surface-parity.toolkit-runtime.001",
      "path": "toolkit-runtime/001.json",
      "summary": {
        "capabilityCount": 8,
        "expectedMechanicCount": 0,
        "mismatchCount": 0,
        "sameCount": 8,
        "status": "passed"
      }
    },
    {
      "id": "rtk-public-surface-parity.toolkit-runtime.002",
      "path": "toolkit-runtime/002.json",
      "summary": {
        "capabilityCount": 8,
        "expectedMechanicCount": 0,
        "mismatchCount": 0,
        "sameCount": 8,
        "status": "passed"
      }
    },
    {
      "id": "rtk-public-surface-parity.toolkit-runtime.003",
      "path": "toolkit-runtime/003.json",
      "summary": {
        "capabilityCount": 8,
        "expectedMechanicCount": 0,
        "mismatchCount": 0,
        "sameCount": 8,
        "status": "passed"
      }
    },
    {
      "id": "rtk-public-surface-parity.toolkit-runtime.004",
      "path": "toolkit-runtime/004.json",
      "summary": {
        "capabilityCount": 8,
        "expectedMechanicCount": 0,
        "mismatchCount": 0,
        "sameCount": 8,
        "status": "passed"
      }
    },
    {
      "id": "rtk-public-surface-parity.toolkit-runtime.005",
      "path": "toolkit-runtime/005.json",
      "summary": {
        "capabilityCount": 8,
        "expectedMechanicCount": 0,
        "mismatchCount": 0,
        "sameCount": 8,
        "status": "passed"
      }
    },
    {
      "id": "rtk-public-surface-parity.toolkit-runtime.006",
      "path": "toolkit-runtime/006.json",
      "summary": {
        "capabilityCount": 8,
        "expectedMechanicCount": 0,
        "mismatchCount": 0,
        "sameCount": 8,
        "status": "passed"
      }
    },
    {
      "id": "rtk-public-surface-parity.toolkit-runtime.007",
      "path": "toolkit-runtime/007.json",
      "summary": {
        "capabilityCount": 8,
        "expectedMechanicCount": 0,
        "mismatchCount": 0,
        "sameCount": 8,
        "status": "passed"
      }
    },
    {
      "id": "rtk-public-surface-parity.toolkit-runtime.008",
      "path": "toolkit-runtime/008.json",
      "summary": {
        "capabilityCount": 3,
        "expectedMechanicCount": 0,
        "mismatchCount": 0,
        "sameCount": 3,
        "status": "passed"
      }
    }
  ],
  "reportId": "rtk-public-surface-parity.toolkit-runtime",
  "schemaVersion": 1,
  "sources": {
    "typescript": {
      "commit": "50c1fe284da298525ea5a153d680084a06149ffe",
      "contractHashes": {
        "redux-toolkit-runtime-and-source": "506ad07549e03b33b8914d26436b37c4a23b7e45b549cfe015400e39c95b74f5"
      },
      "repository": "sdk"
    },
    "unreal": {
      "commit": "2105e827cd5495f627708fe1b12ce10f7d0c2dc7",
      "contractHashes": {
        "rtk-hpp-public-closure": "7b0722dd9ecd67441f44ca6214ffc7fdaa678084253142d0762c09729981662d"
      },
      "repository": "sdk-ue-5"
    }
  },
  "summary": {
    "capabilityCount": 59,
    "expectedMechanicCount": 0,
    "mismatchCount": 0,
    "sameCount": 59,
    "status": "passed"
  }
}
