{
  "$schema": "../../../report-index.schema.json",
  "generatedBy": "scripts/check-sdk-parity.py",
  "parts": [
    {
      "id": "sdk-capability-parity.cli-contract.001",
      "path": "cli-contract/001.json",
      "summary": {
        "capabilityCount": 3,
        "expectedMechanicCount": 0,
        "mismatchCount": 0,
        "sameCount": 3,
        "status": "passed"
      }
    }
  ],
  "reportId": "sdk-capability-parity.cli-contract",
  "schemaVersion": 1,
  "sources": {
    "typescript": {
      "commit": "781738335697a9286acdb0bb17c47bcb98ea72d2",
      "contractHashes": {
        "sdk-source-and-cli-contract": "abfe8cda5acd5478e4dd727ebc330d8fbe073e174fa36cf3c483be644623831d"
      },
      "repository": "sdk"
    },
    "unreal": {
      "commit": "d7c04895692b1285ee49c318df9cd1e45dc58b01",
      "contractHashes": {
        "sdk-source-and-cli-contract": "6e1e50e8f35f3deee40e389e24578504b931ff5b1f4c26bed0deb789c409e664"
      },
      "repository": "sdk-ue-5"
    }
  },
  "summary": {
    "capabilityCount": 3,
    "expectedMechanicCount": 0,
    "mismatchCount": 0,
    "sameCount": 3,
    "status": "passed"
  }
}
