{
  "$schema": "../../../report-index.schema.json",
  "generatedBy": "scripts/check-rtk-parity.py",
  "parts": [
    {
      "id": "rtk-public-surface-parity.toolkit-source.001",
      "path": "toolkit-source/001.json",
      "summary": {
        "capabilityCount": 8,
        "expectedMechanicCount": 0,
        "mismatchCount": 0,
        "sameCount": 8,
        "status": "passed"
      }
    },
    {
      "id": "rtk-public-surface-parity.toolkit-source.002",
      "path": "toolkit-source/002.json",
      "summary": {
        "capabilityCount": 8,
        "expectedMechanicCount": 0,
        "mismatchCount": 0,
        "sameCount": 8,
        "status": "passed"
      }
    },
    {
      "id": "rtk-public-surface-parity.toolkit-source.003",
      "path": "toolkit-source/003.json",
      "summary": {
        "capabilityCount": 8,
        "expectedMechanicCount": 0,
        "mismatchCount": 0,
        "sameCount": 8,
        "status": "passed"
      }
    },
    {
      "id": "rtk-public-surface-parity.toolkit-source.004",
      "path": "toolkit-source/004.json",
      "summary": {
        "capabilityCount": 8,
        "expectedMechanicCount": 0,
        "mismatchCount": 0,
        "sameCount": 8,
        "status": "passed"
      }
    },
    {
      "id": "rtk-public-surface-parity.toolkit-source.005",
      "path": "toolkit-source/005.json",
      "summary": {
        "capabilityCount": 8,
        "expectedMechanicCount": 0,
        "mismatchCount": 0,
        "sameCount": 8,
        "status": "passed"
      }
    },
    {
      "id": "rtk-public-surface-parity.toolkit-source.006",
      "path": "toolkit-source/006.json",
      "summary": {
        "capabilityCount": 8,
        "expectedMechanicCount": 0,
        "mismatchCount": 0,
        "sameCount": 8,
        "status": "passed"
      }
    },
    {
      "id": "rtk-public-surface-parity.toolkit-source.007",
      "path": "toolkit-source/007.json",
      "summary": {
        "capabilityCount": 8,
        "expectedMechanicCount": 0,
        "mismatchCount": 0,
        "sameCount": 8,
        "status": "passed"
      }
    },
    {
      "id": "rtk-public-surface-parity.toolkit-source.008",
      "path": "toolkit-source/008.json",
      "summary": {
        "capabilityCount": 8,
        "expectedMechanicCount": 0,
        "mismatchCount": 0,
        "sameCount": 8,
        "status": "passed"
      }
    },
    {
      "id": "rtk-public-surface-parity.toolkit-source.009",
      "path": "toolkit-source/009.json",
      "summary": {
        "capabilityCount": 8,
        "expectedMechanicCount": 0,
        "mismatchCount": 0,
        "sameCount": 8,
        "status": "passed"
      }
    },
    {
      "id": "rtk-public-surface-parity.toolkit-source.010",
      "path": "toolkit-source/010.json",
      "summary": {
        "capabilityCount": 8,
        "expectedMechanicCount": 0,
        "mismatchCount": 0,
        "sameCount": 8,
        "status": "passed"
      }
    },
    {
      "id": "rtk-public-surface-parity.toolkit-source.011",
      "path": "toolkit-source/011.json",
      "summary": {
        "capabilityCount": 8,
        "expectedMechanicCount": 0,
        "mismatchCount": 0,
        "sameCount": 8,
        "status": "passed"
      }
    },
    {
      "id": "rtk-public-surface-parity.toolkit-source.012",
      "path": "toolkit-source/012.json",
      "summary": {
        "capabilityCount": 8,
        "expectedMechanicCount": 0,
        "mismatchCount": 0,
        "sameCount": 8,
        "status": "passed"
      }
    },
    {
      "id": "rtk-public-surface-parity.toolkit-source.013",
      "path": "toolkit-source/013.json",
      "summary": {
        "capabilityCount": 8,
        "expectedMechanicCount": 0,
        "mismatchCount": 0,
        "sameCount": 8,
        "status": "passed"
      }
    },
    {
      "id": "rtk-public-surface-parity.toolkit-source.014",
      "path": "toolkit-source/014.json",
      "summary": {
        "capabilityCount": 8,
        "expectedMechanicCount": 0,
        "mismatchCount": 0,
        "sameCount": 8,
        "status": "passed"
      }
    },
    {
      "id": "rtk-public-surface-parity.toolkit-source.015",
      "path": "toolkit-source/015.json",
      "summary": {
        "capabilityCount": 8,
        "expectedMechanicCount": 0,
        "mismatchCount": 0,
        "sameCount": 8,
        "status": "passed"
      }
    },
    {
      "id": "rtk-public-surface-parity.toolkit-source.016",
      "path": "toolkit-source/016.json",
      "summary": {
        "capabilityCount": 8,
        "expectedMechanicCount": 0,
        "mismatchCount": 0,
        "sameCount": 8,
        "status": "passed"
      }
    },
    {
      "id": "rtk-public-surface-parity.toolkit-source.017",
      "path": "toolkit-source/017.json",
      "summary": {
        "capabilityCount": 8,
        "expectedMechanicCount": 0,
        "mismatchCount": 0,
        "sameCount": 8,
        "status": "passed"
      }
    },
    {
      "id": "rtk-public-surface-parity.toolkit-source.018",
      "path": "toolkit-source/018.json",
      "summary": {
        "capabilityCount": 2,
        "expectedMechanicCount": 0,
        "mismatchCount": 0,
        "sameCount": 2,
        "status": "passed"
      }
    }
  ],
  "reportId": "rtk-public-surface-parity.toolkit-source",
  "schemaVersion": 1,
  "sources": {
    "typescript": {
      "commit": "9275069c0c42cd9127d74781de4abce9036358a2",
      "contractHashes": {
        "redux-toolkit-runtime-and-source": "506ad07549e03b33b8914d26436b37c4a23b7e45b549cfe015400e39c95b74f5"
      },
      "repository": "sdk"
    },
    "unreal": {
      "commit": "b0c083230a707acb2e54a8fd10c1bcb57f99ef5c",
      "contractHashes": {
        "rtk-hpp-public-closure": "271e50839df964dea131b2db5e29a3e60bcee2c4446808f1cd42c8cc75f39acd"
      },
      "repository": "sdk-ue-5"
    }
  },
  "summary": {
    "capabilityCount": 138,
    "expectedMechanicCount": 0,
    "mismatchCount": 0,
    "sameCount": 138,
    "status": "passed"
  }
}
