{
  "$schema": "../../../report-index.schema.json",
  "generatedBy": "scripts/check-sdk-parity.py",
  "parts": [
    {
      "id": "sdk-capability-parity.cli-config.001",
      "path": "cli-config/001.json",
      "summary": {
        "capabilityCount": 3,
        "expectedMechanicCount": 0,
        "mismatchCount": 0,
        "sameCount": 3,
        "status": "passed"
      }
    }
  ],
  "reportId": "sdk-capability-parity.cli-config",
  "schemaVersion": 1,
  "sources": {
    "typescript": {
      "commit": "f2fb41b528d8a0b14289e401da50cb61fc9e94b4",
      "contractHashes": {
        "sdk-source-and-cli-contract": "9bf3c6ce68de9c5db2f274c2d33f739eb7148d7d343e05dda4a47a7e23b26d88"
      },
      "repository": "sdk"
    },
    "unreal": {
      "commit": "5d87345e0d7c963633b850b1697311eee026bf58",
      "contractHashes": {
        "sdk-source-and-cli-contract": "d455efcdea7658069babb87f0643981e1558cc0934021b4ac3b2d052f065dee7"
      },
      "repository": "sdk-ue-5"
    }
  },
  "summary": {
    "capabilityCount": 3,
    "expectedMechanicCount": 0,
    "mismatchCount": 0,
    "sameCount": 3,
    "status": "passed"
  }
}
