{
  "$schema": "../../report-index.schema.json",
  "generatedBy": "scripts/check-rtk-parity.py",
  "parts": [
    {
      "id": "rtk-public-surface-parity.query-runtime",
      "path": "query-runtime/index.json",
      "summary": {
        "capabilityCount": 14,
        "expectedMechanicCount": 0,
        "mismatchCount": 0,
        "sameCount": 14,
        "status": "passed"
      }
    },
    {
      "id": "rtk-public-surface-parity.query-source",
      "path": "query-source/index.json",
      "summary": {
        "capabilityCount": 87,
        "expectedMechanicCount": 0,
        "mismatchCount": 0,
        "sameCount": 87,
        "status": "passed"
      }
    },
    {
      "id": "rtk-public-surface-parity.toolkit-runtime",
      "path": "toolkit-runtime/index.json",
      "summary": {
        "capabilityCount": 59,
        "expectedMechanicCount": 0,
        "mismatchCount": 0,
        "sameCount": 59,
        "status": "passed"
      }
    },
    {
      "id": "rtk-public-surface-parity.toolkit-source",
      "path": "toolkit-source/index.json",
      "summary": {
        "capabilityCount": 138,
        "expectedMechanicCount": 0,
        "mismatchCount": 0,
        "sameCount": 138,
        "status": "passed"
      }
    }
  ],
  "reportId": "rtk-public-surface-parity",
  "schemaVersion": 1,
  "sources": {
    "typescript": {
      "commit": "9275069c0c42cd9127d74781de4abce9036358a2",
      "contractHashes": {
        "redux-toolkit-runtime-and-source": "506ad07549e03b33b8914d26436b37c4a23b7e45b549cfe015400e39c95b74f5"
      },
      "repository": "sdk"
    },
    "unreal": {
      "commit": "b0c083230a707acb2e54a8fd10c1bcb57f99ef5c",
      "contractHashes": {
        "rtk-hpp-public-closure": "271e50839df964dea131b2db5e29a3e60bcee2c4446808f1cd42c8cc75f39acd"
      },
      "repository": "sdk-ue-5"
    }
  },
  "summary": {
    "capabilityCount": 298,
    "expectedMechanicCount": 0,
    "mismatchCount": 0,
    "sameCount": 298,
    "status": "passed"
  }
}
