{
  "$schema": "../../../report-index.schema.json",
  "generatedBy": "scripts/check-sdk-parity.py",
  "parts": [
    {
      "id": "sdk-capability-parity.cli-npc.001",
      "path": "cli-npc/001.json",
      "summary": {
        "capabilityCount": 8,
        "expectedMechanicCount": 0,
        "mismatchCount": 0,
        "sameCount": 8,
        "status": "passed"
      }
    },
    {
      "id": "sdk-capability-parity.cli-npc.002",
      "path": "cli-npc/002.json",
      "summary": {
        "capabilityCount": 1,
        "expectedMechanicCount": 0,
        "mismatchCount": 0,
        "sameCount": 1,
        "status": "passed"
      }
    }
  ],
  "reportId": "sdk-capability-parity.cli-npc",
  "schemaVersion": 1,
  "sources": {
    "typescript": {
      "commit": "25a149ec7286d8e4db1dbff8028a4a796575f5d0",
      "contractHashes": {
        "sdk-source-and-cli-contract": "a2057535fa2f6e5eb46248c683efcbdbfd023b29e395c9e177b49d42d270c386"
      },
      "repository": "sdk"
    },
    "unreal": {
      "commit": "e679082e67657f3c4d8f3ad0fc3a6eb7c067a021",
      "contractHashes": {
        "sdk-source-and-cli-contract": "d1c02197ae4d86df0a59220e48168815e97e62aa4983306b162085697ec0a206"
      },
      "repository": "sdk-ue-5"
    }
  },
  "summary": {
    "capabilityCount": 9,
    "expectedMechanicCount": 0,
    "mismatchCount": 0,
    "sameCount": 9,
    "status": "passed"
  }
}
