{
  "$schema": "../../report-index.schema.json",
  "generatedBy": "scripts/check-sdk-parity.py",
  "parts": [
    {
      "id": "sdk-capability-parity.cli-bridge",
      "path": "cli-bridge/index.json",
      "summary": {
        "capabilityCount": 3,
        "expectedMechanicCount": 0,
        "mismatchCount": 0,
        "sameCount": 3,
        "status": "passed"
      }
    },
    {
      "id": "sdk-capability-parity.cli-config",
      "path": "cli-config/index.json",
      "summary": {
        "capabilityCount": 3,
        "expectedMechanicCount": 0,
        "mismatchCount": 0,
        "sameCount": 3,
        "status": "passed"
      }
    },
    {
      "id": "sdk-capability-parity.cli-contract",
      "path": "cli-contract/index.json",
      "summary": {
        "capabilityCount": 3,
        "expectedMechanicCount": 0,
        "mismatchCount": 0,
        "sameCount": 3,
        "status": "passed"
      }
    },
    {
      "id": "sdk-capability-parity.cli-diagnostics",
      "path": "cli-diagnostics/index.json",
      "summary": {
        "capabilityCount": 4,
        "expectedMechanicCount": 0,
        "mismatchCount": 0,
        "sameCount": 4,
        "status": "passed"
      }
    },
    {
      "id": "sdk-capability-parity.cli-ghost",
      "path": "cli-ghost/index.json",
      "summary": {
        "capabilityCount": 11,
        "expectedMechanicCount": 0,
        "mismatchCount": 0,
        "sameCount": 11,
        "status": "passed"
      }
    },
    {
      "id": "sdk-capability-parity.cli-memory",
      "path": "cli-memory/index.json",
      "summary": {
        "capabilityCount": 5,
        "expectedMechanicCount": 0,
        "mismatchCount": 0,
        "sameCount": 5,
        "status": "passed"
      }
    },
    {
      "id": "sdk-capability-parity.cli-npc",
      "path": "cli-npc/index.json",
      "summary": {
        "capabilityCount": 9,
        "expectedMechanicCount": 0,
        "mismatchCount": 0,
        "sameCount": 9,
        "status": "passed"
      }
    },
    {
      "id": "sdk-capability-parity.cli-rules",
      "path": "cli-rules/index.json",
      "summary": {
        "capabilityCount": 2,
        "expectedMechanicCount": 0,
        "mismatchCount": 0,
        "sameCount": 2,
        "status": "passed"
      }
    },
    {
      "id": "sdk-capability-parity.cli-setup",
      "path": "cli-setup/index.json",
      "summary": {
        "capabilityCount": 2,
        "expectedMechanicCount": 0,
        "mismatchCount": 0,
        "sameCount": 2,
        "status": "passed"
      }
    },
    {
      "id": "sdk-capability-parity.cli-soul",
      "path": "cli-soul/index.json",
      "summary": {
        "capabilityCount": 5,
        "expectedMechanicCount": 0,
        "mismatchCount": 0,
        "sameCount": 5,
        "status": "passed"
      }
    },
    {
      "id": "sdk-capability-parity.source-structure",
      "path": "source-structure/index.json",
      "summary": {
        "capabilityCount": 7,
        "expectedMechanicCount": 7,
        "mismatchCount": 0,
        "sameCount": 0,
        "status": "passed"
      }
    }
  ],
  "reportId": "sdk-capability-parity",
  "schemaVersion": 1,
  "sources": {
    "typescript": {
      "commit": "25a149ec7286d8e4db1dbff8028a4a796575f5d0",
      "contractHashes": {
        "sdk-source-and-cli-contract": "a2057535fa2f6e5eb46248c683efcbdbfd023b29e395c9e177b49d42d270c386"
      },
      "repository": "sdk"
    },
    "unreal": {
      "commit": "2105e827cd5495f627708fe1b12ce10f7d0c2dc7",
      "contractHashes": {
        "sdk-source-and-cli-contract": "7495d4ea30335ba71c2b8845e0726f8efbb00bcab382ce20842dad63626870c2"
      },
      "repository": "sdk-ue-5"
    }
  },
  "summary": {
    "capabilityCount": 54,
    "expectedMechanicCount": 7,
    "mismatchCount": 0,
    "sameCount": 47,
    "status": "passed"
  }
}
