{
  "$schema": "../../../report-index.schema.json",
  "generatedBy": "scripts/check-rtk-parity.py",
  "parts": [
    {
      "id": "rtk-public-surface-parity.query-source.001",
      "path": "query-source/001.json",
      "summary": {
        "capabilityCount": 8,
        "expectedMechanicCount": 0,
        "mismatchCount": 0,
        "sameCount": 8,
        "status": "passed"
      }
    },
    {
      "id": "rtk-public-surface-parity.query-source.002",
      "path": "query-source/002.json",
      "summary": {
        "capabilityCount": 8,
        "expectedMechanicCount": 0,
        "mismatchCount": 0,
        "sameCount": 8,
        "status": "passed"
      }
    },
    {
      "id": "rtk-public-surface-parity.query-source.003",
      "path": "query-source/003.json",
      "summary": {
        "capabilityCount": 8,
        "expectedMechanicCount": 0,
        "mismatchCount": 0,
        "sameCount": 8,
        "status": "passed"
      }
    },
    {
      "id": "rtk-public-surface-parity.query-source.004",
      "path": "query-source/004.json",
      "summary": {
        "capabilityCount": 8,
        "expectedMechanicCount": 0,
        "mismatchCount": 0,
        "sameCount": 8,
        "status": "passed"
      }
    },
    {
      "id": "rtk-public-surface-parity.query-source.005",
      "path": "query-source/005.json",
      "summary": {
        "capabilityCount": 8,
        "expectedMechanicCount": 0,
        "mismatchCount": 0,
        "sameCount": 8,
        "status": "passed"
      }
    },
    {
      "id": "rtk-public-surface-parity.query-source.006",
      "path": "query-source/006.json",
      "summary": {
        "capabilityCount": 8,
        "expectedMechanicCount": 0,
        "mismatchCount": 0,
        "sameCount": 8,
        "status": "passed"
      }
    },
    {
      "id": "rtk-public-surface-parity.query-source.007",
      "path": "query-source/007.json",
      "summary": {
        "capabilityCount": 8,
        "expectedMechanicCount": 0,
        "mismatchCount": 0,
        "sameCount": 8,
        "status": "passed"
      }
    },
    {
      "id": "rtk-public-surface-parity.query-source.008",
      "path": "query-source/008.json",
      "summary": {
        "capabilityCount": 8,
        "expectedMechanicCount": 0,
        "mismatchCount": 0,
        "sameCount": 8,
        "status": "passed"
      }
    },
    {
      "id": "rtk-public-surface-parity.query-source.009",
      "path": "query-source/009.json",
      "summary": {
        "capabilityCount": 8,
        "expectedMechanicCount": 0,
        "mismatchCount": 0,
        "sameCount": 8,
        "status": "passed"
      }
    },
    {
      "id": "rtk-public-surface-parity.query-source.010",
      "path": "query-source/010.json",
      "summary": {
        "capabilityCount": 8,
        "expectedMechanicCount": 0,
        "mismatchCount": 0,
        "sameCount": 8,
        "status": "passed"
      }
    },
    {
      "id": "rtk-public-surface-parity.query-source.011",
      "path": "query-source/011.json",
      "summary": {
        "capabilityCount": 7,
        "expectedMechanicCount": 0,
        "mismatchCount": 0,
        "sameCount": 7,
        "status": "passed"
      }
    }
  ],
  "reportId": "rtk-public-surface-parity.query-source",
  "schemaVersion": 1,
  "sources": {
    "typescript": {
      "commit": "9275069c0c42cd9127d74781de4abce9036358a2",
      "contractHashes": {
        "redux-toolkit-runtime-and-source": "506ad07549e03b33b8914d26436b37c4a23b7e45b549cfe015400e39c95b74f5"
      },
      "repository": "sdk"
    },
    "unreal": {
      "commit": "5cd51d43e7fe8bac369bdf7b77d9f74e85616785",
      "contractHashes": {
        "rtk-hpp-public-closure": "bb338647c7db6e66dca13a0ef3d6587c59cbcee5ec4e2906154e8f9ba0640447"
      },
      "repository": "sdk-ue-5"
    }
  },
  "summary": {
    "capabilityCount": 87,
    "expectedMechanicCount": 0,
    "mismatchCount": 0,
    "sameCount": 87,
    "status": "passed"
  }
}
