{
  "$schema": "../../../report-index.schema.json",
  "generatedBy": "scripts/check-rtk-parity.py",
  "parts": [
    {
      "id": "rtk-public-surface-parity.query-runtime.001",
      "path": "query-runtime/001.json",
      "summary": {
        "capabilityCount": 8,
        "expectedMechanicCount": 0,
        "mismatchCount": 0,
        "sameCount": 8,
        "status": "passed"
      }
    },
    {
      "id": "rtk-public-surface-parity.query-runtime.002",
      "path": "query-runtime/002.json",
      "summary": {
        "capabilityCount": 6,
        "expectedMechanicCount": 0,
        "mismatchCount": 0,
        "sameCount": 6,
        "status": "passed"
      }
    }
  ],
  "reportId": "rtk-public-surface-parity.query-runtime",
  "schemaVersion": 1,
  "sources": {
    "typescript": {
      "commit": "9275069c0c42cd9127d74781de4abce9036358a2",
      "contractHashes": {
        "redux-toolkit-runtime-and-source": "506ad07549e03b33b8914d26436b37c4a23b7e45b549cfe015400e39c95b74f5"
      },
      "repository": "sdk"
    },
    "unreal": {
      "commit": "6c6fe1241f27abc1dae7b421d9f1c0fa4506bc38",
      "contractHashes": {
        "rtk-hpp-public-closure": "bb338647c7db6e66dca13a0ef3d6587c59cbcee5ec4e2906154e8f9ba0640447"
      },
      "repository": "sdk-ue-5"
    }
  },
  "summary": {
    "capabilityCount": 14,
    "expectedMechanicCount": 0,
    "mismatchCount": 0,
    "sameCount": 14,
    "status": "passed"
  }
}
